{
  "contract_version": "t01-draft-1",
  "request_id": "t01-chat-request-1",
  "conversation_id": "t01-conversation-1",
  "company_id": "demo-metal",
  "event_id": "514cd7721cf86b6c1002",
  "insight_version": "projection-v1",
  "context": {
    "schema_version": "0.1.0",
    "conversation_id": "t01-conversation-1",
    "company_id": "demo-metal",
    "event_id": "514cd7721cf86b6c1002",
    "insight_version": "projection-v1",
    "is_demo": true,
    "context_snapshot": {
      "snapshot_id": "t01-snapshot-1",
      "created_at": "2026-10-20T17:00:00+00:00",
      "company": {
        "schema_version": "0.1.0",
        "company_id": "demo-metal",
        "company_label": "Тестовая металлургическая компания",
        "profile_version": "fixture-v1",
        "profile_as_of": null,
        "is_demo": true,
        "features": [
          {
            "id": "okved_codes",
            "label": "okved_codes",
            "value": "[\"24.10\"]",
            "unit": null,
            "period": null,
            "status": "known",
            "provenance": {
              "kind": "demo",
              "locator": "fixtures.py#okved_codes",
              "as_of": null
            }
          },
          {
            "id": "okved_names",
            "label": "okved_names",
            "value": "[\"Производство чугуна, стали и ферросплавов\"]",
            "unit": null,
            "period": null,
            "status": "known",
            "provenance": {
              "kind": "demo",
              "locator": "fixtures.py#okved_names",
              "as_of": null
            }
          },
          {
            "id": "registration_region",
            "label": "registration_region",
            "value": "Челябинская область",
            "unit": null,
            "period": null,
            "status": "known",
            "provenance": {
              "kind": "demo",
              "locator": "fixtures.py#registration_region",
              "as_of": null
            }
          },
          {
            "id": "ownership_form",
            "label": "ownership_form",
            "value": "ООО",
            "unit": null,
            "period": null,
            "status": "known",
            "provenance": {
              "kind": "demo",
              "locator": "fixtures.py#ownership_form",
              "as_of": null
            }
          },
          {
            "id": "annual_revenue_rub",
            "label": "annual_revenue_rub",
            "value": 800000000.0,
            "unit": "RUB",
            "period": null,
            "status": "known",
            "provenance": {
              "kind": "demo",
              "locator": "fixtures.py#annual_revenue_rub",
              "as_of": null
            }
          },
          {
            "id": "banking_services",
            "label": "banking_services",
            "value": "[\"credit\", \"leasing\"]",
            "unit": null,
            "period": null,
            "status": "known",
            "provenance": {
              "kind": "demo",
              "locator": "fixtures.py#banking_services",
              "as_of": null
            }
          },
          {
            "id": "trade_countries",
            "label": "trade_countries",
            "value": null,
            "unit": null,
            "period": null,
            "status": "unknown",
            "provenance": {
              "kind": "demo",
              "locator": "fixtures.py#trade_countries",
              "as_of": null
            }
          },
          {
            "id": "development_stage",
            "label": "development_stage",
            "value": null,
            "unit": null,
            "period": null,
            "status": "unknown",
            "provenance": {
              "kind": "demo",
              "locator": "fixtures.py#development_stage",
              "as_of": null
            }
          }
        ],
        "limitations": [
          "Дата и период выручки не восстановлены из отсутствующих данных."
        ]
      },
      "event": {
        "schema_version": "0.1.0",
        "event_id": "514cd7721cf86b6c1002",
        "original_title": "Спрос на сталь в России в 2026 году может снизиться на 0,5% год к году",
        "text": "Внутренний спрос на сталь в России в 2026 году может снизиться на 0,5% год к году, сообщила «Северсталь» в отчетности за третий квартал. Таким образом, объем потребления металла в этом году может составить около 38,7 млн тонн против 38,9 млн тонн годом ранее. Это соответствует уровню 2016 года, но ниже, чем в 2017–2024 годах. Ранее компания ожидала снижения потребления металла в 2026 году на 7%. Гендиректор «Северстали» Александр Шевелев отметил, что прогноз улучшен с учетом частичной реализации отложенного спроса в третьем квартале. Но, добавил топ-менеджер, рынку пока не удается восстановить утраченные объемы после снижения потребления в 2025 году на 14%. В четвертом квартале, прокомментировал господин Шевелев, ожидается сезонное охлаждение спроса и рынок остается ниже уровней, предшествовавших спаду. За девять месяцев 2026 года спрос на сталь вырос примерно на 1% год к году, оценивает «Северсталь». Подробнее читайте в материале «Потребители потянулись к металлу» .",
        "summary": "Компания-источник пересмотрела прогноз спроса на сталь. Событие требует проверки применимости к вашему бизнесу.",
        "published_at": "2026-10-20T13:55:38+00:00",
        "collected_at": "2026-10-20T16:02:02.690088+00:00",
        "is_fictional": false,
        "sources": [
          {
            "id": "news:514cd7721cf86b6c1002",
            "kind": "news",
            "title": "Спрос на сталь в России в 2026 году может снизиться на 0,5% год к году",
            "publisher": "Коммерсантъ",
            "url": "https://www.kommersant.ru/doc/9043090",
            "locator": "https://www.kommersant.ru/doc/9043090",
            "published_at": "2026-10-20T13:55:38+00:00",
            "retrieved_at": "2026-10-20T16:02:02.690088+00:00",
            "forecast_period": null,
            "is_fictional": false,
            "availability": "available",
            "fragments": [
              {
                "id": "quote-826ffcb74d37579d",
                "text": "Спрос на сталь в России в 2026 году может снизиться на 0,5% год к году",
                "locator": "characters:0:70"
              },
              {
                "id": "title",
                "text": "Спрос на сталь в России в 2026 году может снизиться на 0,5% год к году",
                "locator": "title"
              }
            ]
          }
        ],
        "facts": [
          {
            "id": "t01-demo-metal:event-title",
            "text": "Спрос на сталь в России в 2026 году может снизиться на 0,5% год к году",
            "kind": "source_fact",
            "evidence": [
              {
                "source_id": "news:514cd7721cf86b6c1002",
                "fragment_id": "title"
              }
            ],
            "feature_ids": [],
            "assumptions": [],
            "limitations": [
              "Заголовок источника; прогноз не становится фактом будущего."
            ]
          }
        ],
        "limitations": [
          "Суть события предоставлена редакционным слоем."
        ]
      },
      "insight": {
        "schema_version": "0.1.0",
        "insight_id": "t01-demo-metal",
        "insight_version": "projection-v1",
        "company_id": "demo-metal",
        "profile_version": "fixture-v1",
        "event_id": "514cd7721cf86b6c1002",
        "content_status": "partial",
        "analyzed_at": "2026-10-20T17:00:00+00:00",
        "is_demo": true,
        "effect_title": "Возможное давление на новые заказы",
        "importance": "high",
        "importance_reason": "Демо-оценка: событие связано с основной отраслью компании; финансовый эффект не измерен.",
        "conclusion": {
          "id": "t01-demo-metal:summary",
          "text": "Есть совпадение отрасли; влияние остаётся гипотезой.",
          "kind": "ai_inference",
          "evidence": [
            {
              "source_id": "news:514cd7721cf86b6c1002",
              "fragment_id": "quote-826ffcb74d37579d"
            },
            {
              "source_id": "company:demo-metal:okved_names",
              "fragment_id": "quote-fcf5d4360b1a1881"
            }
          ],
          "feature_ids": [
            "okved_names"
          ],
          "assumptions": [],
          "limitations": [
            "Резюме исходного AI-ответа; логическое следование требует отдельной проверки."
          ]
        },
        "event_facts": [
          {
            "id": "t01-demo-metal:event-title",
            "text": "Спрос на сталь в России в 2026 году может снизиться на 0,5% год к году",
            "kind": "source_fact",
            "evidence": [
              {
                "source_id": "news:514cd7721cf86b6c1002",
                "fragment_id": "title"
              }
            ],
            "feature_ids": [],
            "assumptions": [],
            "limitations": [
              "Заголовок источника; прогноз не становится фактом будущего."
            ]
          },
          {
            "id": "t01-demo-metal:claim:1",
            "text": "Спрос на сталь в России в 2026 году может снизиться на 0,5% год к году",
            "kind": "source_fact",
            "evidence": [
              {
                "source_id": "news:514cd7721cf86b6c1002",
                "fragment_id": "quote-826ffcb74d37579d"
              }
            ],
            "feature_ids": [],
            "assumptions": [],
            "limitations": []
          },
          {
            "id": "t01-demo-metal:claim:2",
            "text": "Заявленный ОКВЭД: Производство чугуна, стали и ферросплавов",
            "kind": "source_fact",
            "evidence": [
              {
                "source_id": "company:demo-metal:okved_names",
                "fragment_id": "quote-fcf5d4360b1a1881"